{
  "schemaVersion": 1,
  "id": "grant-demo",
  "deviceID": "device-demo",
  "sessionID": "session-demo",
  "planHash": "4bccd7a9ac366006096f1a9c06323adfee38337b066c0b6ba6a7033163934710",
  "consentRevision": 1,
  "issuedAtEpochMs": 1000,
  "expiresAtEpochMs": 61000,
  "kind": "explicitUI",
  "consumed": false
}
